{
  "$schema": "../../schemas/benchmark-campaign.schema.json",
  "schema_version": "1.0.0",
  "campaign_id": "abk:benchmark-campaign:artifact-dag-core-v1",
  "protocol_id": "abk:benchmark:pattern-adoption-v1",
  "status": "benchmark_pending",
  "outcome": "UNSCORED",
  "host": "codex",
  "component": {
    "manifest_id": "abk:pattern-adoption:artifact-dag-core",
    "name": "Artifact DAG + root provenance",
    "pattern_id": "openspec-artifact-graph"
  },
  "source_pattern": {
    "repository": "Fission-AI/openspec",
    "commit": "45cca5db6137ed209117cc70510eb3e057fb981b",
    "path": "src/core/artifact-graph",
    "evidence_locator": "outputs/02-fission-openspec.md"
  },
  "branches": ["control", "source_native", "abk_native"],
  "cases": [
    {
      "case_id": "COM-01-normal-primary",
      "case_class": "common",
      "title": "Build readiness from a valid artifact graph",
      "fixture": "fixtures/COM-01-normal-primary.json",
      "fixture_sha256": "62f997d1e3a0aded32dde6468b3ec342d7c3a52d87839deeb7c6cf7a040d1bfe",
      "model_dependent": true,
      "repeats": 3,
      "timeout_seconds": 120,
      "oracle": "Valid graph yields deterministic readiness and provenance evidence.",
      "stop_condition": "Stop after the readiness record and evidence inventory are emitted."
    },
    {
      "case_id": "COM-02-normal-variant",
      "case_class": "common",
      "title": "Build readiness from a valid graph with a second dependency shape",
      "fixture": "fixtures/COM-02-normal-variant.json",
      "fixture_sha256": "846ed6317d8bf0af1ed2aa2017e647e9d2502db399f451322eebae9fc9806943",
      "model_dependent": true,
      "repeats": 3,
      "timeout_seconds": 120,
      "oracle": "A different valid dependency shape produces the same stable contract shape.",
      "stop_condition": "Stop after the variant readiness record is emitted."
    },
    {
      "case_id": "COM-03-normal-repeat",
      "case_class": "common",
      "title": "Repeat the same graph without evidence drift",
      "fixture": "fixtures/COM-03-normal-repeat.json",
      "fixture_sha256": "a337f79552f96b4dba030fa08f4e58cf760ee26a770d45b54d4946dbb7f5a152",
      "model_dependent": true,
      "repeats": 3,
      "timeout_seconds": 120,
      "oracle": "Repeated input preserves the graph, readiness hash, and evidence shape.",
      "stop_condition": "Stop after the repeat comparison record is emitted."
    },
    {
      "case_id": "COM-04-boundary-minimum",
      "case_class": "common",
      "title": "Accept the smallest valid project graph",
      "fixture": "fixtures/COM-04-boundary-minimum.json",
      "fixture_sha256": "dca00b56517ec5eaf491ba3d071f4da9823918c7ab78b168ff02ac971875d686",
      "model_dependent": false,
      "repeats": 1,
      "timeout_seconds": 90,
      "oracle": "The minimum valid input is accepted without implicit extra artifacts.",
      "stop_condition": "Stop after the minimum boundary result is recorded."
    },
    {
      "case_id": "COM-05-invalid-input",
      "case_class": "common",
      "title": "Reject malformed graph input explicitly",
      "fixture": "fixtures/COM-05-invalid-input.json",
      "fixture_sha256": "9cf491ac8ad57dd9ea630adc10ca396bec2338ea7ac08735684e222581dd307b",
      "model_dependent": false,
      "repeats": 1,
      "timeout_seconds": 90,
      "oracle": "Malformed input fails with a typed, actionable error and no partial state.",
      "stop_condition": "Stop at the first contract error; do not continue or repair silently."
    },
    {
      "case_id": "COM-06-stop-interrupt",
      "case_class": "common",
      "title": "Preserve terminal state when execution stops",
      "fixture": "fixtures/COM-06-stop-interrupt.json",
      "fixture_sha256": "177325140d819ca9ce3416409a70122911a4f44148a8a788e3a0de5505b53c40",
      "model_dependent": true,
      "repeats": 3,
      "timeout_seconds": 120,
      "oracle": "An interrupt produces an explicit terminal stop record and no ambiguous success.",
      "stop_condition": "Stop on the declared interrupt signal and persist the terminal result."
    },
    {
      "case_id": "SPC-01-domain-boundary",
      "case_class": "component_specific",
      "title": "Reject a dependency outside the declared project root",
      "fixture": "fixtures/SPC-01-domain-boundary.json",
      "fixture_sha256": "7232aaa098862821374ad852d0c07d6a82f83928ec8bdfd0738e1132a726cfb9",
      "model_dependent": false,
      "repeats": 1,
      "timeout_seconds": 90,
      "oracle": "A root-boundary violation is rejected before any external path is read.",
      "stop_condition": "Stop before resolving an out-of-root dependency."
    },
    {
      "case_id": "SPC-02-failure-path",
      "case_class": "component_specific",
      "title": "Reject an unknown artifact reference",
      "fixture": "fixtures/SPC-02-failure-path.json",
      "fixture_sha256": "1072ff864f4c87d33128f9f86a7426ad3a42ce3f5aceebe6a2e2ec00acb21576",
      "model_dependent": false,
      "repeats": 1,
      "timeout_seconds": 90,
      "oracle": "An unknown artifact is reported as a contract failure with no readiness result.",
      "stop_condition": "Stop at the unknown-reference error."
    },
    {
      "case_id": "SPC-03-recovery-rollback",
      "case_class": "component_specific",
      "title": "Recover after a partially written derived state",
      "fixture": "fixtures/SPC-03-recovery-rollback.json",
      "fixture_sha256": "ce339295134d2036f96615accc8d1e1e9f7a5fd4c73821b9fab2c868cb0fefaa",
      "model_dependent": true,
      "repeats": 3,
      "timeout_seconds": 150,
      "oracle": "Recovery removes only owned derived state and restores a valid resumable boundary.",
      "stop_condition": "Stop after recovery evidence proves ownership-scoped cleanup."
    },
    {
      "case_id": "SPC-04-composition-handoff",
      "case_class": "component_specific",
      "title": "Hand off a validated graph to the next component",
      "fixture": "fixtures/SPC-04-composition-handoff.json",
      "fixture_sha256": "7ef01303a6b87f5a07fc187a09002b613f5ae405b3095babfde8b6ac2da6d4c3",
      "model_dependent": true,
      "repeats": 3,
      "timeout_seconds": 150,
      "oracle": "Only a validated graph crosses the handoff and the receiving contract can verify its provenance.",
      "stop_condition": "Stop after the receiving component acknowledges the provenance-bound handoff."
    }
  ],
  "run_policy": {
    "primary_cell_count": 30,
    "expected_raw_runs": 66
  },
  "isolation": {
    "external_network": false,
    "credentials": false,
    "production_resources": false,
    "external_writes": false,
    "git_mutation": false,
    "workspace_root": "runs",
    "environment_roots": ["HOME", "USERPROFILE", "APPDATA", "LOCALAPPDATA", "XDG_CONFIG_HOME", "XDG_DATA_HOME"],
    "forbidden_inputs": ["conversation_state", "prior_run_cache", "unrecorded_findings"]
  },
  "evidence_layout": {
    "root": "runs",
    "run_path_template": "runs/{case_id}/{branch_id}/R{repeat}/",
    "required_files": ["run.json", "stdout.log", "stderr.log", "tool-events.jsonl", "output-inventory.json", "oracle-result.json"]
  },
  "completed_primary_cells": 0,
  "completed_raw_runs": 0,
  "run_evidence_ids": []
}
